{
  "$schema": "https://json-schema.org/draft/2020-12/schema",
  "$id": "https://batch-outliner.invalid/schemas/record.schema.json",
  "title": "Batch Outliner published record",
  "type": "object",
  "additionalProperties": false,
  "required": [
    "schema_version",
    "catalog_id",
    "quality",
    "source"
  ],
  "properties": {
    "schema_version": { "enum": [1, 2] },
    "record_id": { "type": "string", "minLength": 1 },
    "catalog_id": { "type": ["integer", "null"] },
    "vendor": { "type": "string", "minLength": 1 },
    "product_type": { "type": "string", "minLength": 1 },
    "name": { "type": "string", "minLength": 1 },
    "quality": {
      "enum": ["unusable", "bad_perspective", "good"]
    },
    "source": {
      "enum": ["catalog", "alternative"]
    },
    "product_url": { "type": ["string", "null"], "format": "uri" },
    "species": { "type": ["string", "null"] },
    "tags": { "type": "array", "items": { "type": "string" } },
    "features": { "type": "array", "items": { "type": "string" } },
    "sizes": {
      "type": "array",
      "items": {
        "type": "object",
        "additionalProperties": false,
        "required": ["label", "short_label", "unit"],
        "properties": {
          "label": { "type": "string", "minLength": 1 },
          "short_label": { "type": ["string", "null"] },
          "price": { "type": ["number", "null"], "minimum": 0 },
          "length": { "type": ["number", "null"], "exclusiveMinimum": 0 },
          "circumference": { "type": ["number", "null"], "exclusiveMinimum": 0 },
          "widest_circumference": { "type": ["number", "null"], "exclusiveMinimum": 0 },
          "widest_label": { "type": ["string", "null"] },
          "unit": { "enum": ["in", "cm", "mm"] }
        }
      }
    },
    "variants": {
      "type": "object",
      "minProperties": 1,
      "propertyNames": { "pattern": "^(?!general$)[a-zA-Z0-9][a-zA-Z0-9_-]{0,63}$" },
      "additionalProperties": {
        "type": "object",
        "additionalProperties": false,
        "required": ["sizes", "quality", "source", "file"],
        "properties": {
          "sizes": {
            "type": "array", "minItems": 1, "uniqueItems": true,
            "items": { "type": "string", "minLength": 1 }
          },
          "quality": { "enum": ["unusable", "bad_perspective", "good"] },
          "source": { "enum": ["catalog", "alternative"] },
          "file": { "type": "string", "pattern": "^variants/[a-zA-Z0-9][a-zA-Z0-9_-]{0,63}\\.svg$" }
        }
      }
    },
    "notes": { "type": ["string", "null"] }
  },
  "if": { "properties": { "catalog_id": { "type": "null" } } },
  "then": {
    "required": [
      "record_id", "vendor", "product_type", "name", "product_url", "species",
      "tags", "features", "sizes", "notes"
    ]
  },
  "allOf": [
    {
      "if": { "properties": { "schema_version": { "const": 1 } } },
      "then": { "not": { "required": ["variants"] } }
    },
    {
      "if": { "required": ["variants"] },
      "then": { "properties": { "schema_version": { "const": 2 } } }
    }
  ]
}
